{
  "version": 2,
  "brand": "HMQC",
  "brand_id": "hmqc",
  "streams": [
    {
      "id": "hmqc-1",
      "url": "?channel=[CHANNEL]&subtype=0",
      "protocol": "dvrip",
      "port": 34567,
      "models": [
        "*"
      ],
      "notes": "DVR-IP/Sofia main stream (Xiongmai-based firmware)"
    },
    {
      "id": "hmqc-2",
      "url": "?channel=[CHANNEL]&subtype=1",
      "protocol": "dvrip",
      "port": 34567,
      "models": [
        "*"
      ],
      "notes": "DVR-IP/Sofia sub stream (Xiongmai-based firmware)"
    }
  ]
}
