{
  "version": 2,
  "brand": "Kindermeubel",
  "brand_id": "kindermeubel",
  "streams": [
    {
      "id": "kindermeubel-1",
      "url": "snapshot.jpg?user=[USERNAME]&pwd=[PASSWORD]&strm=[CHANNEL]",
      "protocol": "http",
      "port": 0,
      "models": [
        "CIP-39218AT"
      ]
    }
  ]
}
