{
  "version": 2,
  "brand": "Techview",
  "brand_id": "techview",
  "streams": [
    {
      "id": "techview-1",
      "url": "videostream.asf",
      "protocol": "http",
      "port": 88,
      "models": [
        "006E060233FE",
        "287",
        "CQ3834",
        "F9805W",
        "N287",
        "Other",
        "QC3836"
      ]
    },
    {
      "id": "techview-2",
      "url": "videostream.cgi?",
      "protocol": "http",
      "port": 0,
      "models": [
        "006E060B996D",
        "3832",
        "Other",
        "QC-3834"
      ]
    },
    {
      "id": "techview-3",
      "url": "snapshot.jpg?user=[USERNAME]&pwd=[PASSWORD]&strm=[CHANNEL]",
      "protocol": "http",
      "port": 0,
      "models": [
        "264"
      ]
    },
    {
      "id": "techview-4",
      "url": "videostream.asf?user=[USERNAME]&pwd=[PASSWORD]&resolution=[WIDTH]*[HEIGHT]",
      "protocol": "http",
      "port": 0,
      "models": [
        "3831",
        "cq3834",
        "GATE",
        "N287",
        "Other",
        "QC-3638",
        "qc3832"
      ]
    },
    {
      "id": "techview-5",
      "url": "tmpfs/auto.jpg",
      "protocol": "http",
      "port": 0,
      "models": [
        "3831",
        "3846",
        "720IP",
        "720p",
        "CQ3834",
        "CQ3846",
        "HDIP",
        "N287",
        "QC-3638",
        "QC-3840",
        "QC-3844",
        "QC3846",
        "QC3848"
      ]
    },
    {
      "id": "techview-6",
      "url": "videostream.asf?user=[USERNAME]&pwd=[PASSWORD]&resolution=64&rate=0",
      "protocol": "http",
      "port": 0,
      "models": [
        "3846",
        "N287",
        "qc3638",
        "QC-3638"
      ]
    },
    {
      "id": "techview-7",
      "url": "/12",
      "protocol": "rtsp",
      "port": 8001,
      "models": [
        "3846",
        "720P",
        "HBP",
        "iveway",
        "N287",
        "Other",
        "QC3122",
        "QC-3638",
        "QC-3834",
        "QC3839",
        "QC-3840",
        "QC-3846",
        "QCC3846",
        "rmr55"
      ]
    },
    {
      "id": "techview-8",
      "url": "/videostream.cgi?",
      "protocol": "http",
      "port": 80,
      "models": [
        "38748"
      ]
    },
    {
      "id": "techview-9",
      "url": "/11",
      "protocol": "rtsp",
      "port": 0,
      "models": [
        "720IP",
        "Gate",
        "N287",
        "Other",
        "QC-3638",
        "QC3832",
        "QC3839",
        "QC-3840",
        "QC3842",
        "QC-3844",
        "UNLISTED"
      ]
    },
    {
      "id": "techview-10",
      "url": "/0/av0",
      "protocol": "rtsp",
      "port": 8001,
      "models": [
        "720IP",
        "qc3638",
        "TS4001"
      ]
    },
    {
      "id": "techview-11",
      "url": "/",
      "protocol": "rtsp",
      "port": 554,
      "models": [
        "C5F0S",
        "QC-3844",
        "tpz"
      ]
    },
    {
      "id": "techview-12",
      "url": "/videostream.asf",
      "protocol": "http",
      "port": 80,
      "models": [
        "CV3130",
        "Other"
      ]
    },
    {
      "id": "techview-13",
      "url": "snapshot",
      "protocol": "http",
      "port": 0,
      "models": [
        "GM8126"
      ]
    },
    {
      "id": "techview-14",
      "url": "videostream.cgi?rate=0&user=[USERNAME]&pwd=[PASSWORD]",
      "protocol": "http",
      "port": 0,
      "models": [
        "GM8126"
      ]
    },
    {
      "id": "techview-15",
      "url": "videostream.asf?usr=[USERNAME]&pwd=[PASSWORD]",
      "protocol": "http",
      "port": 0,
      "models": [
        "N287",
        "qc-3836"
      ]
    },
    {
      "id": "techview-16",
      "url": "/videostream.asf?usr=[USERNAME]&pwd=[PASSWORD]",
      "protocol": "http",
      "port": 80,
      "models": [
        "N287"
      ]
    },
    {
      "id": "techview-17",
      "url": "/videostream.asf?user=[USERNAME]&pwd=[PASSWORD]&resolution=320*240",
      "protocol": "http",
      "port": 80,
      "models": [
        "N287"
      ]
    },
    {
      "id": "techview-18",
      "url": "VIDEO.CGI",
      "protocol": "http",
      "port": 0,
      "models": [
        "N287",
        "QC3836",
        "QCr836"
      ]
    },
    {
      "id": "techview-19",
      "url": "cgi-bin/snapshot.cgi?loginuse=[USERNAME]&loginpas=[PASSWORD]",
      "protocol": "http",
      "port": 0,
      "models": [
        "Other"
      ]
    },
    {
      "id": "techview-20",
      "url": "videostream.cgi?user=[USERNAME]&pwd=[PASSWORD]&resolution=32&rate=0",
      "protocol": "http",
      "port": 0,
      "models": [
        "Other",
        "QC-3638"
      ]
    },
    {
      "id": "techview-21",
      "url": "snapshot.cgi",
      "protocol": "http",
      "port": 0,
      "models": [
        "QC3834-7Link"
      ]
    }
  ]
}
