{
  "version": 2,
  "brand": "Advance",
  "brand_id": "advance",
  "streams": [
    {
      "id": "advance-1",
      "url": "videostream.cgi?user=[USERNAME]&pwd=[PASSWORD]",
      "protocol": "http",
      "port": 0,
      "models": [
        "002fvwu",
        "Other"
      ]
    },
    {
      "id": "advance-2",
      "url": "snapshot.cgi?user=[USERNAME]&pwd=[PASSWORD]&count=0",
      "protocol": "http",
      "port": 0,
      "models": [
        "HVC",
        "Other"
      ]
    },
    {
      "id": "advance-3",
      "url": "/videostream.cgi?user=[USERNAME]&pwd=[PASSWORD]",
      "protocol": "http",
      "port": 80,
      "models": [
        "NetCam"
      ]
    },
    {
      "id": "advance-4",
      "url": "/videostream.asf?user=[USERNAME]&pwd=[PASSWORD]&resolution=64&rate=0",
      "protocol": "http",
      "port": 80,
      "models": [
        "NetCam"
      ]
    },
    {
      "id": "advance-5",
      "url": "/videostream.asf?user=[USERNAME]&pwd=[PASSWORD]&resolution=320x240",
      "protocol": "http",
      "port": 80,
      "models": [
        "NetCam"
      ]
    },
    {
      "id": "advance-6",
      "url": "/videostream.cgi",
      "protocol": "http",
      "port": 80,
      "models": [
        "NetCam"
      ]
    },
    {
      "id": "advance-7",
      "url": "/videostream.asf?user=[USERNAME]&pwd=[PASSWORD]",
      "protocol": "http",
      "port": 82,
      "models": [
        "NetCam"
      ]
    },
    {
      "id": "advance-8",
      "url": "videostream.asf",
      "protocol": "http",
      "port": 0,
      "models": [
        "NetCam",
        "Other"
      ]
    },
    {
      "id": "advance-9",
      "url": "/",
      "protocol": "http",
      "port": 80,
      "models": [
        "NetCam"
      ]
    },
    {
      "id": "advance-10",
      "url": "videostream.asf?user=[USERNAME]&pwd=[PASSWORD]&resolution=[WIDTH]x[HEIGHT]",
      "protocol": "http",
      "port": 0,
      "models": [
        "Other",
        "WB-IP03A"
      ]
    },
    {
      "id": "advance-11",
      "url": "ch0_0.h264",
      "protocol": "rtsp",
      "port": 0,
      "models": [
        "Other"
      ]
    },
    {
      "id": "advance-12",
      "url": "videostream.asf?user=[USERNAME]&pwd=[PASSWORD]&resolution=32&rate=0",
      "protocol": "http",
      "port": 0,
      "models": [
        "Other"
      ]
    },
    {
      "id": "advance-13",
      "url": "tmpfs/auto.jpg",
      "protocol": "http",
      "port": 0,
      "models": [
        "Other"
      ]
    },
    {
      "id": "advance-14",
      "url": "snapshot.cgi?user=[USERNAME]&pwd=[PASSWORD]",
      "protocol": "http",
      "port": 0,
      "models": [
        "Other"
      ]
    },
    {
      "id": "advance-15",
      "url": "cgi-bin/sf.cgi",
      "protocol": "http",
      "port": 0,
      "models": [
        "Other"
      ]
    },
    {
      "id": "advance-16",
      "url": "img/video.mjpeg",
      "protocol": "http",
      "port": 0,
      "models": [
        "Other"
      ]
    },
    {
      "id": "advance-17",
      "url": "/video.cgi?resolution=VGA",
      "protocol": "http",
      "port": 80,
      "models": [
        "WB-IP03A",
        "wp00030A"
      ]
    },
    {
      "id": "advance-18",
      "url": "videostream.cgi?resolution=8&rate=13",
      "protocol": "http",
      "port": 0,
      "models": [
        "WB-IP03A"
      ]
    },
    {
      "id": "advance-19",
      "url": "video.cgi?resolution=VGA",
      "protocol": "http",
      "port": 0,
      "models": [
        "WB-IP03A"
      ]
    },
    {
      "id": "advance-20",
      "url": "videostream.cgi?rate=11",
      "protocol": "http",
      "port": 0,
      "models": [
        "WB-IP03A"
      ]
    },
    {
      "id": "advance-21",
      "url": "videostream.cgi?rate=0",
      "protocol": "http",
      "port": 0,
      "models": [
        "WB-IP03A"
      ]
    },
    {
      "id": "advance-22",
      "url": "videostream.asf?user=[USERNAME]&pwd=[PASSWORD]",
      "protocol": "http",
      "port": 0,
      "models": [
        "WB-IP03A"
      ]
    },
    {
      "id": "advance-23",
      "url": "videostream.asf?user=[USERNAME]&pwd=[PASSWORD]&resolution=64&rate=0",
      "protocol": "http",
      "port": 0,
      "models": [
        "WB-IP03A"
      ]
    }
  ]
}
