{
  "version": 2,
  "brand": "Sovmiku",
  "brand_id": "sovmiku",
  "streams": [
    {
      "id": "sovmiku-1",
      "url": "/11",
      "protocol": "rtsp",
      "port": 5544,
      "models": [
        "SFWS318"
      ]
    },
    {
      "id": "sovmiku-2",
      "url": "cam1/mpeg4",
      "protocol": "rtsp",
      "port": 0,
      "models": [
        "SFWS318"
      ]
    }
  ]
}
